{
  "claim_id": "CLAIM_MM_002",
  "wording": "Separated deterministic, configuration-driven screening score generation from an optional Anthropic LLM narrative layer whose prompt instructs it not to alter official scores, thresholds, status, or scenario calculations.",
  "evidence_ids": [
    "MM_SCORE_001",
    "MM_LLM_001",
    "MM_AUTHOR_001"
  ],
  "evidence_state": "OBSERVED",
  "allowed_contexts": [
    "resume",
    "interview",
    "networking",
    "Business Systems",
    "Implementation",
    "Data Operations"
  ],
  "forbidden_contexts": [
    "predictive machine learning",
    "autonomous decision-making",
    "model-driven scoring",
    "AI decision engine"
  ],
  "human_approval": false,
  "date": "2026-08-28",
  "version": "1"
}
