{
  "claim_id": "CLAIM_MM_003",
  "wording": "Integrated Google Places nearby-search and U.S. Census ACS demographic data feeds into the coffee-shop screening workflow.",
  "evidence_ids": [
    "MM_PLACES_001",
    "MM_CENSUS_001"
  ],
  "evidence_state": "VERIFIED",
  "allowed_contexts": [
    "resume",
    "interview",
    "networking",
    "Business Systems",
    "Implementation",
    "Data Operations",
    "Digital Solutions"
  ],
  "forbidden_contexts": [
    "enterprise API architecture",
    "data engineering platform",
    "exhaustive competitor intelligence",
    "Google Maps enterprise expertise"
  ],
  "human_approval": false,
  "date": "2026-08-28",
  "version": "1"
}
